{
  "schemaVersion": 2,
  "angleUnit": "radian",
  "reference": {
    "implementation": "IAU SOFA ANSI C release 2023-10-11 (unmodified)",
    "releasePage": "https://www.iausofa.org/2023-10-11c",
    "license": "https://www.iausofa.org/terms-and-conditions",
    "archiveSha256": "d9c10833cae8b4d9361a0ffda31ec361fd1262362025bec4d4e51a880150ace2",
    "officialTestProgramSha256": "87ec88eac0be306a7060f984af2f1506ade2148332ea9ec70922eb3bf39b382d",
    "officialVectorOrigin": "Values copied from t_sofa_c.c in the unmodified release archive",
    "composedVectorOrigin": "Generated by an independent C driver using fk52h then starpm and linked against the unmodified libsofa_c.a",
    "jplApproximation": "https://ssd.jpl.nasa.gov/planets/approx_pos.html"
  },
  "tolerances": {
    "angleRadians": 1e-12,
    "nutationRadians": 1e-13,
    "aberrationComponent": 1e-12,
    "refractionCoefficient": 1e-15,
    "composedEquatorialRadians": 1e-9,
    "composedSiderealRadians": 1.4e-8,
    "composedHorizontalRadians": 2e-8
  },
  "earthRotationAngles": [
    {
      "id": "sofa-era00-reference",
      "ut1JulianDate": 2454388.5,
      "expected": 0.4022837240028158
    }
  ],
  "meanSiderealTimes": [
    {
      "id": "sofa-gmst06-reference",
      "ut1JulianDate": 2453736.5,
      "ttJulianDate": 2453736.5,
      "expected": 1.7541749718700912
    }
  ],
  "nutationAngles": [
    {
      "id": "sofa-nut00b-reference",
      "ttJulianDate": 2453736.5,
      "expected": {
        "longitude": -0.000009632552291148363,
        "obliquity": 0.000040631971066211594
      }
    }
  ],
  "fukushimaWilliamsAngles": [
    {
      "id": "sofa-pfw06-reference",
      "ttJulianDate": 2450124.4999,
      "expected": {
        "gamma": -0.0000022433876709979957,
        "phi": 0.4091014602391313,
        "psi": -0.0009501954178013032,
        "obliquity": 0.40910143165873675
      }
    }
  ],
  "aberrationVectors": [
    {
      "id": "sofa-ab-reference",
      "naturalDirection": [
        -0.7632196854673795,
        -0.6086945398306038,
        -0.21676408580639883
      ],
      "observerBarycentricVelocityC": [
        0.000021044018893653786,
        -0.00008910892330442932,
        -0.00003863371479771657
      ],
      "sunObserverDistanceAu": 0.9998092139570879,
      "expected": [
        -0.7631631094219556,
        -0.6087553082505591,
        -0.21679262693684713
      ]
    }
  ],
  "refractionCoefficients": [
    {
      "id": "sofa-refco-optical-reference",
      "atmosphere": {
        "pressureHpa": 800,
        "temperatureCelsius": 10,
        "relativeHumidity": 0.9,
        "wavelengthMicrometers": 0.4
      },
      "expected": {
        "tangent": 0.0002264949956241415,
        "tangentCubed": -2.598658261729344e-7
      }
    }
  ],
  "composedApparentPositions": [
    {
      "id": "sofa-sirius-tokyo-2026",
      "iso": "2026-07-29T12:00:00.000Z",
      "starHR": 2491,
      "earthOrientation": {
        "taiMinusUtcSeconds": 37,
        "dut1Seconds": 0.1234
      },
      "location": {
        "latitude": 35.6812,
        "longitude": 139.7671,
        "timeZone": "Asia/Tokyo"
      },
      "aberration": {
        "observerBarycentricVelocityC": [
          0.00007874929758528587,
          0.000053276261307748114,
          0.000023089297044590353
        ],
        "sunObserverDistanceAu": 1.0152532482509598
      },
      "expected": {
        "astrometricRightAscension": 1.7677184776337111,
        "astrometricDeclination": -0.29190630586643773,
        "apparentRightAscension": 1.7728430496976502,
        "apparentDeclination": -0.2923516820362349,
        "greenwichApparentSiderealTime": 2.219306698451775,
        "altitude": -1.169655094697655,
        "azimuth": 5.614016685766119
      }
    },
    {
      "id": "sofa-arcturus-greenwich-1900",
      "iso": "1900-01-01T00:00:00.000Z",
      "starHR": 5340,
      "earthOrientation": {
        "taiMinusUtcSeconds": 0,
        "dut1Seconds": 0
      },
      "location": {
        "latitude": 51.4769,
        "longitude": 0,
        "timeZone": "Europe/London"
      },
      "aberration": {
        "observerBarycentricVelocityC": [
          -0.00009906391420287261,
          -0.000018569216879229082,
          -0.000008061066079600646
        ],
        "sunObserverDistanceAu": 0.9832662504491844
      },
      "expected": {
        "astrometricRightAscension": 3.734089829480351,
        "astrometricDeclination": 0.3357666395909457,
        "apparentRightAscension": 3.713650913836316,
        "apparentDeclination": 0.34382348687555153,
        "greenwichApparentSiderealTime": 1.748615662835867,
        "altitude": 0.038502787644235016,
        "azimuth": 1.0549919421579557
      }
    },
    {
      "id": "sofa-polaris-sydney-2100",
      "iso": "2100-12-31T00:00:00.000Z",
      "starHR": 424,
      "earthOrientation": {
        "taiMinusUtcSeconds": 37,
        "dut1Seconds": -0.2
      },
      "location": {
        "latitude": -33.8688,
        "longitude": 151.2093,
        "timeZone": "Australia/Sydney"
      },
      "aberration": {
        "observerBarycentricVelocityC": [
          -0.00010009588973015721,
          -0.000012901625411368719,
          -0.000005589811911621156
        ],
        "sunObserverDistanceAu": 0.9834428109735641
      },
      "expected": {
        "astrometricRightAscension": 0.6638479662855306,
        "astrometricDeclination": 1.5579466008849712,
        "apparentRightAscension": 1.5691962904821757,
        "apparentDeclination": 1.5628140987209247,
        "greenwichApparentSiderealTime": 1.7368671990606679,
        "altitude": -0.5986587109216793,
        "azimuth": 6.280010186924449
      }
    }
  ],
  "accuracyScan": {
    "range": {
      "minimumJulianDate": 2415020.5,
      "maximumJulianDate": 2488434.5
    },
    "dateStepDays": 30,
    "dateSamples": 2448,
    "directionGrid": {
      "rightAscensionStepDegrees": 15,
      "declinationsDegrees": [-60, -30, 0, 30, 60],
      "samples": 293760
    },
    "siderealLeadingEquationOfEquinoxes": {
      "maximumDifferenceMilliarcseconds": 2.649329676,
      "rmsDifferenceMilliarcseconds": 1.859047903
    },
    "jplApproximateAberrationVersusSofaEpv00": {
      "maximumDifferenceMilliarcseconds": 20.962142897,
      "rmsDifferenceMilliarcseconds": 10.237598996,
      "maximumVelocityDifferenceMetersPerSecond": 30.469146
    }
  }
}
